path,purpose,build_required,runtime_required,inference_required,deploy_required,exists,kept_in_repo_policy,notes
Dockerfile,Docker build definition,yes,yes,no,yes,True,yes,Required for Render/Docker build
docker/entrypoint.sh,Runtime entrypoint,no,yes,no,yes,True,yes,Runs migrations + gunicorn
requirements.txt,Python dependencies,yes,yes,no,yes,True,yes,Required for image build
run.py,WSGI app entrypoint,no,yes,no,yes,True,yes,Gunicorn uses run:app
config/settings.py,Runtime settings,no,yes,no,yes,True,yes,Loads env-based config
api/,API routes and services,no,yes,no,yes,True,yes,Required for runtime
core/models/predictor.py,Model loader,no,yes,yes,yes,True,yes,Loads model from models/
models/adhd_model.pkl,Runtime model binary,no,yes,yes,yes,True,no,Required for inference unless externalized
artifacts/inference_v4/promotion_scope.json,Inference scope config,no,yes,yes,yes,True,yes,Used to define active/hold domains
